name,type,height,classify,gender,weight,ability,description,evolution,img
 꽁어름,얼음,1,얼음덩이,b,99.5,마이페이스;아이스바디,혹한의 산악 지대에 살지만 드물게 크레베이스의 등에 올라 바다를 건너 거처를 옮기기도 한다.,712;꽁어름;713;크레베이스,https://data1.pokemonkorea.co.kr/newdata/pokedex/full/071201.png
 크레베이스,얼음,2,빙산,b,505,마이페이스;아이스바디,꽁어름을 태우고 걷다가 우락고래 무리를 만나면 싸움이 일어나지 않게 지나간다.,712;꽁어름;713;크레베이스,https://data1.pokemonkorea.co.kr/newdata/pokedex/full/071301.png
 크레베이스,얼음;바위,1.4,빙산,b,262.4,옹골찬턱;아이스바디,아래턱을 감싸고 있는 얼음으로 된 장갑은 강철보다 단단하여 암석을 손쉽게 부서뜨린다. 깊이 쌓인 눈을 가로지르며 험한 산길을 맹진한다.,712;꽁어름;713;크레베이스,https://data1.pokemonkorea.co.kr/newdata/pokedex/full/071302.png
 음뱃,비행;드래곤,0.5,음파,b,8,통찰;틈새포착,큰 귀로 초음파를 내보내서 먹이인 과일을 찾는다. 과사삭벌레를 먹이로 착각하기도 한다.,714;음뱃;715;음번,https://data1.pokemonkorea.co.kr/newdata/pokedex/full/071401.png
 음번,비행;드래곤,1.5,음파,b,85,통찰;틈새포착,거대한 암석도 가루로 만드는 초음파를 발생시키는 잔인한 성격의 포켓몬.,714;음뱃;715;음번,https://data1.pokemonkorea.co.kr/newdata/pokedex/full/071501.png
 제르네아스,페어리,3,생명,u,215,페어리오라,영원한 생명을 나누어 준다고 한다. 수목의 모습으로 1000년 동안 잠들고 부활한다.,NA,https://data1.pokemonkorea.co.kr/newdata/pokedex/full/071601.png
 이벨타르,악;비행,5.8,파괴,u,203,다크오라,날개와 꼬리를 펼치고 빨갛게 빛날 때 살아 있는 생명을 빨아들이는 전설의 포켓몬.,NA,https://data1.pokemonkorea.co.kr/newdata/pokedex/full/071701.png
 지가르데,드래곤;땅,5,질서,u,305,오라브레이크;스웜체인지,셀이 50% 모인 모습이다. 적대하는 자는 일절 봐주지 않고 소멸시킨다.,718;지가르데;718;지가르데;718;지가르데,https://data1.pokemonkorea.co.kr/newdata/pokedex/full/071801.png
 지가르데,드래곤;땅,1.2,질서,u,33.5,오라브레이크;스웜체인지,날카로운 이빨로 상대를 처리한다. 계속 이 몸을 유지할 수 없어서 일정 시간이 지나면 흩어져버린다.,718;지가르데;718;지가르데;718;지가르데,https://data1.pokemonkorea.co.kr/newdata/pokedex/full/071802.png
 지가르데,드래곤;땅,4.5,질서,u,610,스웜체인지,생태계를 위협하는 자를 압도적인 힘으로 제압하는 지가르데의 모습이다.,718;지가르데;718;지가르데;718;지가르데,https://data1.pokemonkorea.co.kr/newdata/pokedex/full/071803.png
 디안시,바위;페어리,0.7,보석,u,8.8,클리어바디,멜리시의 돌연변이다. 분홍빛으로 빛나는 몸은 세계에서 가장 아름답다고 일컬어진다.,719;디안시;719;메가디안시,https://data1.pokemonkorea.co.kr/newdata/pokedex/full/071901.png
 메가디안시,바위;페어리,1.1,보석,u,27.8,매직미러,멜리시의 돌연변이다. 분홍빛으로 빛나는 몸은 세계에서 가장 아름답다고 일컬어진다.,719;디안시;719;메가디안시,https://data1.pokemonkorea.co.kr/newdata/pokedex/full/071902.png
 후파,에스퍼;고스트,0.5,장난,u,9,매지션,공간을 뒤트는 링으로 모든 것을 멀리 떨어진 곳으로 날려버리고 마는 트러블메이커다.,720;후파;720;후파,https://data1.pokemonkorea.co.kr/newdata/pokedex/full/072001.png
 후파,에스퍼;악,6.5,마신,u,490,매지션,진정한 모습일 때는 거대한 힘을 가지고 있다. 원하는 재물을 손에 넣기 위해 그것이 숨겨진 성을 통째로 빼돌려 사라졌다는 전설이 있다.,720;후파;720;후파,https://data1.pokemonkorea.co.kr/newdata/pokedex/full/072002.png
 볼케니온,불꽃;물,1.7,스팀,u,195,저수,수증기를 뿜어내어 자신의 모습을 짙은 안개 속에 숨긴다. 사람이 오지 않는 산에 산다고 한다,NA,https://data1.pokemonkorea.co.kr/newdata/pokedex/full/072101.png
 나몰빼미,풀;비행,0.3,풀깃,b,1.5,심록,경계심이 강하다. 낮에는 광합성으로 힘을 비축하고 밤이 되면 활동을 개시한다.,722;나몰빼미;723;빼미스로우;724;모크나이퍼,https://data1.pokemonkorea.co.kr/newdata/pokedex/full/072201.png
 빼미스로우,풀;비행,0.7,칼날깃,b,16,심록,젠체하고 틈만 나면 날개의 손질을 한다. 깃털의 얼룩이 신경 쓰여 싸우지 못할 때도 있다.,722;나몰빼미;723;빼미스로우;724;모크나이퍼,https://data1.pokemonkorea.co.kr/newdata/pokedex/full/072301.png
 모크나이퍼,풀;고스트,1.6,화살깃,b,36.6,심록,날개에 숨겨진 살깃을 시위에 메겨서 날린다. 100m 앞의 작은 돌도 관통하는 정밀함이다.,722;나몰빼미;723;빼미스로우;724;모크나이퍼,https://data1.pokemonkorea.co.kr/newdata/pokedex/full/072401.png
 모크나이퍼,풀;격투,1.6,화살깃,b,37,심록,히스이의 극한의 추위에 견디기 위해 깃털의 심에 공기를 머금어 방한 기능을 갖췄다. 환경이 진화에 영향을 주는 것으로 판명된다.,722;나몰빼미;723;빼미스로우;724;모크나이퍼,https://data1.pokemonkorea.co.kr/newdata/pokedex/full/072402.png
 냐오불,불꽃,0.4,불고양이,b,4.3,맹화,혀로 털을 정리하면서 배에 쌓인 빠진 털을 태워서 불을 뿜는다. 털을 뱉어내는 방법에 따라 불꽃도 변한다.,725;냐오불;726;냐오히트;727;어흥염,https://data1.pokemonkorea.co.kr/newdata/pokedex/full/072501.png
 냐오히트,불꽃,0.7,불고양이,b,25,맹화,목 주변에 불꽃의 방울이 있다. 불꽃을 뿜어낼 때 딸랑딸랑 높은 소리가 난다.,725;냐오불;726;냐오히트;727;어흥염,https://data1.pokemonkorea.co.kr/newdata/pokedex/full/072601.png
 어흥염,불꽃;악,1.8,힐,b,83,맹화,거칠고 제멋대로인 성격이다. 기분이 내키지 않으면 트레이너의 명령도 아무렇지 않게 무시한다.,725;냐오불;726;냐오히트;727;어흥염,https://data1.pokemonkorea.co.kr/newdata/pokedex/full/072701.png
 누리공,물,0.4,강치,b,7.5,급류,노력하는 성질로 유명하다. 체액을 코로 부풀린 풍선을 적에게 부딪힌다.,728;누리공;729;키요공;730;누리레느,https://data1.pokemonkorea.co.kr/newdata/pokedex/full/072801.png
 키요공,물,0.6,아이돌,b,17.5,급류,댄스가 특기이며 춤추면서 계속해서 물의 풍선을 만들어 적에게 부딪힌다.,728;누리공;729;키요공;730;누리레느,https://data1.pokemonkorea.co.kr/newdata/pokedex/full/072901.png
 누리레느,물;페어리,1.8,솔리스트,b,44,급류,물의 풍선을 노래로 컨트롤한다. 그 멜로디는 동료에게 배우며 대대로 무리에 전해진다.,728;누리공;729;키요공;730;누리레느,https://data1.pokemonkorea.co.kr/newdata/pokedex/full/073001.png
 콕코구리,노말;비행,0.3,딱따구리,b,1.2,날카로운눈;스킬링크,1초당 16번 나무를 쪼아서 구멍을 낸다. 낸 구멍은 먹이를 넣어두는 저장고나 둥지로 쓴다.,731;콕코구리;732;크라파;733;왕큰부리,https://data1.pokemonkorea.co.kr/newdata/pokedex/full/073101.png
 크라파,노말;비행,0.6,나팔입,b,14.8,날카로운눈;스킬링크,먹은 나무열매 씨앗을 부리에 저장한다. 적이나 먹이와 마주치면 한 번에 발사한다.,731;콕코구리;732;크라파;733;왕큰부리,https://data1.pokemonkorea.co.kr/newdata/pokedex/full/073201.png
 왕큰부리,노말;비행,1.1,대,b,26,날카로운눈;스킬링크,부리를 발열시켜 싸운다. 그 온도는 100도를 훨씬 넘어 쪼이기만 해도 큰 화상을 입는다.,731;콕코구리;732;크라파;733;왕큰부리,https://data1.pokemonkorea.co.kr/newdata/pokedex/full/073301.png
 영구스,노말,0.4,순회,b,6,잠복;옹골찬턱,몸의 대부분이 위장이다. 매일 같은 경로를 배회하며 신선한 먹이를 찾는다.,734;영구스;735;형사구스,https://data1.pokemonkorea.co.kr/newdata/pokedex/full/073401.png
 형사구스,노말,0.7,잠복,b,14.2,잠복;옹골찬턱,먹잇감의 흔적을 발견하면 해가 떨어질 때까지 그 자리에 머물며 끈질기게 잠복한다.,734;영구스;735;형사구스,https://data1.pokemonkorea.co.kr/newdata/pokedex/full/073501.png
 턱지충이,벌레,0.4,유충,b,4.4,벌레의알림,커다란 턱은 굵은 가지를 부러뜨릴 정도의 위력을 가졌다. 천적인 파라꼬도 견디지 못하고 도망친다.,736;턱지충이;737;전지충이;738;투구뿌논,https://data1.pokemonkorea.co.kr/newdata/pokedex/full/073601.png
 전지충이,벌레;전기,0.5,배터리,b,10.5,배터리,튼튼한 껍질로 몸을 보호한다. 턱의 끝부분에서 전기를 흘려보내 반격한다.,736;턱지충이;737;전지충이;738;투구뿌논,https://data1.pokemonkorea.co.kr/newdata/pokedex/full/073701.png
 투구뿌논,벌레;전기,1.5,뿔집게,b,45,부유,복부에서 만든 전기를 커다란 턱에 집중시켜서 고출력의 빔을 쏜다.,736;턱지충이;737;전지충이;738;투구뿌논,https://data1.pokemonkorea.co.kr/newdata/pokedex/full/073801.png
 오기지게,격투,0.6,권투,b,7,괴력집게;철주먹,나무를 때려서 떨어진 나무열매를 먹는다. 트레이닝도 되고 먹이도 구해져서 그야말로 일석이조다.,739;오기지게;740;모단단게,https://data1.pokemonkorea.co.kr/newdata/pokedex/full/073901.png
 모단단게,격투;얼음,1.7,털게,b,180,괴력집게;철주먹,떨어진 집게는 매우 맛있다. 일부러 맛보돈을 데리고 산에 올라 찾아다니는 트레이너도 있을 정도다.,739;오기지게;740;모단단게,https://data1.pokemonkorea.co.kr/newdata/pokedex/full/074001.png
 춤추새,불꽃;비행,0.6,댄스,b,3.4,무희,정열적으로 춤추는 모습이 팔데아 사람들의 취향에 맞는지 인기가 매우 좋다.,741;춤추새;741;춤추새;741;춤추새;No. 0741;춤추새,https://data1.pokemonkorea.co.kr/newdata/pokedex/full/074101.png
 춤추새,전기;비행,0.6,댄스,b,3.4,무희,진노랑꿀을 빨아들인 모습. 경쾌한 스텝으로 상대에게 접근하여 전격을 담은 펀치로 KO시킨다.,741;춤추새;741;춤추새;741;춤추새;No. 0741;춤추새,https://data1.pokemonkorea.co.kr/newdata/pokedex/full/074102.png
 춤추새,에스퍼;비행,0.6,댄스,b,3.4,무희,경쾌한 댄스가 건강을 유지하는 데 효과적이란 소문 덕에 인기 있는 스타일이나 팔데아에서는 보기 드문 편이다.,741;춤추새;741;춤추새;741;춤추새;No. 0741;춤추새,https://data1.pokemonkorea.co.kr/newdata/pokedex/full/074103.png
 춤추새,고스트;비행,0.6,댄스,b,3.4,무희,보라꿀을 빨아들인 모습. 환상적인 스텝으로 죽은 자의 영혼을 불러낸다.,741;춤추새;741;춤추새;741;춤추새;No. 0741;춤추새,https://data1.pokemonkorea.co.kr/newdata/pokedex/full/074104.png
 에블리,벌레;페어리,0.1,재니등에,b,0.2,꿀모으기;인분,꽃가루와 꿀을 아주 좋아한다. 꼬모카의 꽃가루를 노리고 에블리가 주변을 날아다닌다.,742;에블리;743;에리본,https://data1.pokemonkorea.co.kr/newdata/pokedex/full/074201.png
 에리본,벌레;페어리,0.2,재니등에,b,0.5,꿀모으기;인분,꽃가루와 꿀을 섞어서 경단을 만든다. 조합하는 종류와 양에 따라 효과가 달라진다.,742;에블리;743;에리본,https://data1.pokemonkorea.co.kr/newdata/pokedex/full/074301.png
 암멍이,바위,0.5,강아지,b,9.2,날카로운눈;의기양양,어렸을 때는 매우 잘 따른다. 자라면서 성질이 사나워지지만 주인에게 입은 은혜는 잊지 않는다.,744;암멍이;745;루가루암,https://data1.pokemonkorea.co.kr/newdata/pokedex/full/074401.png
 루가루암,바위,0.8,늑대,b,25,날카로운눈;모래헤치기,날카로운 발톱과 이빨로 먹이를 공격한다. 신뢰하는 트레이너의 지시에는 충실히 따른다.,744;암멍이;745;루가루암,https://data1.pokemonkorea.co.kr/newdata/pokedex/full/074501.png
 루가루암,바위,1.1,늑대,b,25,날카로운눈;의기양양,바위로 된 갈기로 다가오는 자를 베어 버린다. 트레이너의 지시도 마음에 안 들면 따르지 않는다.,744;암멍이;745;루가루암,https://data1.pokemonkorea.co.kr/newdata/pokedex/full/074502.png
 루가루암,바위,0.8,늑대,b,25,단단한발톱,평소에는 잘 짖지도 않지만 일단 싸우기 시작하면 자비 없이 상대를 몰아붙인다.,744;암멍이;745;루가루암,https://data1.pokemonkorea.co.kr/newdata/pokedex/full/074503.png
 약어리,물,0.2,잔물고기,b,0.3,어군,1마리로는 너무나도 허약해서 무리를 지어 상대에게 맞서는 능력을 습득했다.,746;약어리;746;약어리,https://data1.pokemonkorea.co.kr/newdata/pokedex/full/074601.png
 약어리,물,8.2,잔물고기,b,78.6,어군,1마리는 아주 약하지만 다 같이 힘을 합치면 바다의 마물이라 불리는 존재가 된다.,746;약어리;746;약어리,https://data1.pokemonkorea.co.kr/newdata/pokedex/full/074602.png
 시마사리,독;물,0.4,깨비사리,b,8,무도한행동;유연,먹이를 찾아 해변을 배회한다. 부러진 찌르성게의 가시를 먹으려다 마비되어 있는 경우가 많다.,747;시마사리;748;더시마사리,https://data1.pokemonkorea.co.kr/newdata/pokedex/full/074701.png
 더시마사리,독;물,0.7,깨비사리,b,14.5,무도한행동;유연,자신의 다리로 만든 돔이 보금자리다. 조류를 뿔로 감지해서 주위를 살핀다.,747;시마사리;748;더시마사리,https://data1.pokemonkorea.co.kr/newdata/pokedex/full/074801.png
 머드나기,땅,1,당나귀,b,110,마이페이스;지구력,두르고 있는 진흙은 먹었던 흙을 되새김해서 만든 것이다. 장시간 햇볕을 쬐어도 마르지 않는다.,749;머드나기;750;만마드,https://data1.pokemonkorea.co.kr/newdata/pokedex/full/074901.png
 만마드,땅,2.5,만마,b,920,마이페이스;지구력,힘쓰는 일뿐만 아니라 도자기의 재료가 되는 질 좋은 진흙을 만들기 때문에 소중히 여겨져 왔다.,749;머드나기;750;만마드,https://data1.pokemonkorea.co.kr/newdata/pokedex/full/075001.png
 물거미,물;벌레,0.3,수,b,4,수포,엉덩이로 수포를 부풀려서 머리를 감싼다. 동료끼리 수포의 크기를 비교한다.,751;물거미;752;깨비물거미,https://data1.pokemonkorea.co.kr/newdata/pokedex/full/075101.png
 깨비물거미,물;벌레,1.8,수,b,82,수포,다리로 수포를 날려서 먹이를 감싼 다음 익사시킨다. 그리고는 시간을 들여 천천히 음미한다.,751;물거미;752;깨비물거미,https://data1.pokemonkorea.co.kr/newdata/pokedex/full/075201.png
 짜랑랑,풀,0.3,풀사마귀,b,1.5,리프가드,낮잠을 방해받는 것을 매우 싫어한다. 일광욕으로 모은 에너지로 빔을 발사할 수 있다.,753;짜랑랑;754;라란티스,https://data1.pokemonkorea.co.kr/newdata/pokedex/full/075301.png
 라란티스,풀,0.9,꽃사마귀,b,18.5,리프가드,꽃의 달콤한 향기에 이끌려 찾아온 벌레포켓몬을 동료인 척 방심시키고는 낫으로 마무리한다.,753;짜랑랑;754;라란티스,https://data1.pokemonkorea.co.kr/newdata/pokedex/full/075401.png
 자마슈,풀;페어리,0.2,발광,b,1.5,발광;포자,머리의 갓은 매우 맛있다. 숲속의 포켓몬들에게 먹히지만 하룻밤 만에 재생한다.,755;자마슈;756;마셰이드,https://data1.pokemonkorea.co.kr/newdata/pokedex/full/075501.png
 마셰이드,풀;페어리,1,발광,b,11.5,발광;포자,깜빡이는 포자의 빛으로 먹이를 유인해서 잠들게 한다. 손끝으로 생기를 흡수한다.,755;자마슈;756;마셰이드,https://data1.pokemonkorea.co.kr/newdata/pokedex/full/075601.png
 야도뇽,독;불꽃,0.6,독도마뱀,b,4.8,부식,먹잇감을 도발해서 좁은 암석 지대로 유인한 뒤 어지러워지는 독가스를 뿜어서 마무리한다.,757;야도뇽;758;염뉴트,https://data1.pokemonkorea.co.kr/newdata/pokedex/full/075701.png
 염뉴트,독;불꽃,1.2,독도마뱀,f,22.2,부식,독가스에 어질어질해진 상대를 요염한 몸놀림으로 유혹해서 충실한 부하로 만들어 버린다.,757;야도뇽;758;염뉴트,https://data1.pokemonkorea.co.kr/newdata/pokedex/full/075801.png
 포곰곰,노말;격투,0.5,바둥바둥,b,6.8,복슬복슬;서투름,푹신푹신한 털은 감촉이 뛰어나지만 섣불리 손을 댔다간 호되게 반격을 당하고 만다.,759;포곰곰;760;이븐곰,https://data1.pokemonkorea.co.kr/newdata/pokedex/full/075901.png
 이븐곰,노말;격투,2.1,강한완력,b,135,복슬복슬;서투름,동료로 인정하면 애정을 표현하기 위해 껴안으려 하지만 뼈가 으스러질 수 있으므로 위험하다.,759;포곰곰;760;이븐곰,https://data1.pokemonkorea.co.kr/newdata/pokedex/full/076001.png
 달콤아,풀,0.3,후르츠,f,3.2,리프가드;둔감,"과일을 졸인 것만 같은 달콤한 땀을 흘리기 때문에, 달콤한 음식이 적었던 옛날에는 매우 귀하게 여겨졌다.",761;달콤아;762;달무리나;763;달코퀸,https://data1.pokemonkorea.co.kr/newdata/pokedex/full/076101.png
 달무리나,풀,0.7,후르츠,f,8.2,리프가드;둔감,기운이 솟을 것만 같은 달콤한 향기를 흩뿌린다. 땀 억제제의 향료로 인기가 좋다.,761;달콤아;762;달무리나;763;달코퀸,https://data1.pokemonkorea.co.kr/newdata/pokedex/full/076201.png
 달코퀸,풀,1.2,후르츠,f,21.4,리프가드;여왕의위엄,자존심이 강하고 공격적이지만 꼭지의 왕관을 건드리면 금세 얌전해진다고 한다.,761;달콤아;762;달무리나;763;달코퀸,https://data1.pokemonkorea.co.kr/newdata/pokedex/full/076301.png
 큐아링,페어리,0.1,꽃따기,b,0.3,플라워베일;힐링시프트,덩굴을 사용해 꽃을 따서 자신을 꾸민다. 몸에 붙은 꽃은 무슨 이유에서인지 시들지 않는다.,NA,https://data1.pokemonkorea.co.kr/newdata/pokedex/full/076401.png
 하랑우탄,노말;에스퍼,1.5,현자,b,76,정신력;텔레파시,숲의 포켓몬들에게 계속해서 지시를 내리는 모습 때문에 옛날에는 인간이었던 것으로 여겨지고 있다.,NA,https://data1.pokemonkorea.co.kr/newdata/pokedex/full/076501.png
 내던숭이,격투,2,연계,b,82.8,리시버,단단한 나무열매를 던져서 싸운다. 볼을 던지는 것이 어설픈 트레이너의 명령은 듣지 않는다.,NA,https://data1.pokemonkorea.co.kr/newdata/pokedex/full/076601.png
 꼬시레,벌레;물,0.5,주행,b,12,도망태세,상한 것이든 쓰레기든 닥치는 대로 먹어 치우는 자연의 청소부. 둥지 주변은 언제나 깨끗하다.,767;꼬시레;768;갑주무사,https://data1.pokemonkorea.co.kr/newdata/pokedex/full/076701.png
 갑주무사,벌레;물,2,장갑,b,108,위기회피,이기기 위해서는 수단을 가리지 않는다. 상대의 빈틈을 찌른 뒤 앞발의 작은 발톱으로 마무리한다.,767;꼬시레;768;갑주무사,https://data1.pokemonkorea.co.kr/newdata/pokedex/full/076801.png
 모래꿍,고스트;땅,0.5,모래산,b,70,꾸덕꾸덕굳기,삽을 잃어버리면 나뭇가지 등을 대신 꽂고 다니며 새로운 삽을 찾을 때까지 마음을 달랜다.,769;모래꿍;770;모래성이당,https://data1.pokemonkorea.co.kr/newdata/pokedex/full/076901.png
 모래성이당,고스트;땅,1.3,모래성,b,250,꾸덕꾸덕굳기,"작은 포켓몬을 모래로 된 몸 안으로 끌어들인 뒤, 자신이 원할 때 생기를 빨아들이는 무서운 포켓몬.",769;모래꿍;770;모래성이당,https://data1.pokemonkorea.co.kr/newdata/pokedex/full/077001.png
 해무기,물,0.3,해삼,b,1.2,내용물분출,따뜻하고 얕은 여울에 산다. 상대와 마주치면 체내 기관을 입으로 뿜어서 때려눕힌다.,NA,https://data1.pokemonkorea.co.kr/newdata/pokedex/full/077101.png
 타입:널,노말,1.9,인공,u,120.5,전투무장,극비였던 연구 자료가 도난당한 뒤 가라르지방에서 새로 만들어졌다는 소문이 있다.,772;타입:널;773;실버디,https://data1.pokemonkorea.co.kr/newdata/pokedex/full/077201.png
 실버디,노말,2.3,인공,u,100.5,AR시스템,파트너와의 강한 유대에 의해 숨겨진 능력을 각성했다. 자유자재로 타입을 바꿀 수 있다.,772;타입:널;773;실버디,https://data1.pokemonkorea.co.kr/newdata/pokedex/full/077301.png
 메테노,바위;비행,0.3,유성,u,40,리밋실드,원래 오존층에 살고 있으며 몸의 껍질이 무거워지면 지상을 향해 떨어진다.,774;메테노;774;메테노,https://data1.pokemonkorea.co.kr/newdata/pokedex/full/077401.png
 메테노,바위;비행,0.3,유성,u,0.3,리밋실드,대기 중의 먼지를 먹고 있다. 먹은 먼지의 성분에 따라 코어의 색조가 정해진다.,774;메테노;774;메테노,https://data1.pokemonkorea.co.kr/newdata/pokedex/full/077402.png
 자말라,노말,0.4,꿈결,b,19.9,절대안깸,일생을 잠든 채로 보낸다. 자말라만이 분해할 수 있는 맹독성의 잎사귀를 먹이로 삼는다.,NA,https://data1.pokemonkorea.co.kr/newdata/pokedex/full/077501.png
 폭거북스,불꽃;드래곤,2,폭발거북,b,212,조가비갑옷,폭약으로 코팅된 등껍질을 짊어지고 있다. 공격하는 상대에게 대폭발로 반격한다.,NA,https://data1.pokemonkorea.co.kr/newdata/pokedex/full/077601.png
 토게데마루,전기;강철,0.3,동글동글,b,3.3,철가시;피뢰침,등에 난 긴 털로 번개나 전기포켓몬의 전격을 받아 전기 주머니에 충전한다.,NA,https://data1.pokemonkorea.co.kr/newdata/pokedex/full/077701.png
 따라큐,고스트;페어리,0.2,탈,b,0.7,탈,볕이 들지 않는 어두운 곳에 산다. 사람들 앞에 나타날 때는 피카츄를 본뜬 천으로 온몸을 가린다.,NA,https://data1.pokemonkorea.co.kr/newdata/pokedex/full/077801.png
 치갈기,물;에스퍼,0.9,이갈기,b,19,비비드바디;옹골찬턱,강하게 이를 갈아서 뇌를 자극한다. 이를 통해 만들어 낸 사이코 파워를 머리의 돌기를 통해 발사한다.,NA,https://data1.pokemonkorea.co.kr/newdata/pokedex/full/077901.png
 할비롱,노말;드래곤,3,느긋누긋,b,185,발끈;초식,해발 3000m가 넘는 산에 산다. 드물게 마을로 내려와 아이들과 논다.,NA,https://data1.pokemonkorea.co.kr/newdata/pokedex/full/078001.png
 타타륜,고스트;풀,3.9,해초조각,u,210,강철술사,해저를 떠도는 해초가 침몰선의 부품을 거두어들여서 고스트포켓몬으로 다시 태어났다.,NA,https://data1.pokemonkorea.co.kr/newdata/pokedex/full/078101.png
 짜랑꼬,드래곤,0.6,비늘,b,29.7,방탄;방음,머리의 비늘을 동료끼리 부딪히며 싸우는 법을 배운다. 이를 통해 기술과 정신을 단련한다.,782;짜랑꼬;783;짜랑고우;784;짜랑고우거,https://data1.pokemonkorea.co.kr/newdata/pokedex/full/078201.png
 짜랑고우,드래곤;격투,1.2,비늘,b,47,방탄;방음,비늘이 떨어진 상처투성이인 몸은 강자라는 증표다. 상대를 쓰러뜨린 후 상처를 보여준다.,782;짜랑꼬;783;짜랑고우;784;짜랑고우거,https://data1.pokemonkorea.co.kr/newdata/pokedex/full/078301.png
 짜랑고우거,드래곤;격투,1.6,비늘,b,78.2,방탄;방음,상대와 마주치면 꼬리의 비늘로 소리를 내어 위협한다. 이에 겁먹지 않은 강자만을 상대로 싸운다.,782;짜랑꼬;783;짜랑고우;784;짜랑고우거,https://data1.pokemonkorea.co.kr/newdata/pokedex/full/078401.png
 카푸꼬꼬꼭,전기;페어리,1.8,토속신,u,20.5,일렉트릭메이커,호기심 왕성한 멜레멜레의 수호신이다. 번개 구름을 불러 우레를 몸에 비축한다.,NA,https://data1.pokemonkorea.co.kr/newdata/pokedex/full/078501.png
 카푸나비나,에스퍼;페어리,1.2,토속신,u,18.6,사이코메이커,천진난만하고 잔혹한 아칼라의 수호신이다. 향기로운 꽃향기가 에너지의 근원이다.,NA,https://data1.pokemonkorea.co.kr/newdata/pokedex/full/078601.png
 카푸브루루,풀;페어리,1.9,토속신,u,45.5,그래스메이커,큰 나무를 뽑아서 빙빙 휘두른다. 초목을 무성하게 만들어 그 에너지를 흡수한다.,NA,https://data1.pokemonkorea.co.kr/newdata/pokedex/full/078701.png
 카푸느지느,물;페어리,1.3,토속신,u,21.2,미스트메이커,짙은 안개로 적을 혼란시켜 자멸하게 만드는 무서움을 지녔다. 해류가 에너지의 근원이다.,NA,https://data1.pokemonkorea.co.kr/newdata/pokedex/full/078801.png
 코스모그,에스퍼,0.2,성운,u,0.1,천진,연약한 가스 상태의 몸이다. 대기의 먼지를 모으며 천천히 성장한다.,789;코스모그;790;코스모움;791;솔가레오,https://data1.pokemonkorea.co.kr/newdata/pokedex/full/078901.png
 코스모움,에스퍼,0.1,원시성,u,999.9,옹골참,죽은 것처럼 전혀 움직이지 않지만 만지면 어렴풋이 따뜻하다. 아주 옛날에는 달의 고치로 불렸다.,789;코스모그;790;코스모움;791;솔가레오,https://data1.pokemonkorea.co.kr/newdata/pokedex/full/079001.png
 솔가레오,에스퍼;강철,3.4,일륜,u,230,메탈프로텍트,다른 세계에 산다고 전해진다. 온몸에서 격렬한 빛을 내뿜어 깜깜한 밤도 한낮처럼 비춘다.,789;코스모그;790;코스모움;791;솔가레오,https://data1.pokemonkorea.co.kr/newdata/pokedex/full/079101.png
